Asignado;;Columns;Columns Description;TipoVariable;Preprocessing;Tratamiento;count;unique;top;freq;mean;std;min;00-ene-00;00-ene-00;00-ene-00;max
Asignado;;Columns;Columns Description;TipoVariable;Preprocessing;Tratamiento;500.000;3;win8defender;494.604;;;;;;;
Esther;;ProductName; Defender state information e.g. win8defender;object;;variable sin nulos, con 3 registros únicos y poca variabilidad (99% en un unico valor con el target distribuido en un 50%). Lo borramos por no aportar informacion.;500.000;53;1.1.15200.1;216.491;;;;;;;
Esther;;EngineVersion; Defender state information e.g. 1.1.12603.0;object;OHE;variable sin nulos, con 53 registro únicos y con poca variabilidad (el 84% en dos valores) con distinta distribución del target en estos dos valores. Agrupar registros. Se podría limpiar borrando el '1.1.' con el que empiezan los registros.;500.000;95;4.18.1807.18075;288.809;;;;;;;
Esther;;AppVersion; Defender state information e.g. 4.9.10586.0;object;OHE;variable con 95 valores unicos, sin nulos y con 58% en un unico valor. En general el target distribuido entorno al 50% en los 5 primeros valores... y en los siguientes ya encontramos algun valor con mayor variabilidad.  Se podría limpiar borrando el '4.' con el que empiezan los registros.;500.000;6.455;1.273.1420.0;5.771;;;;;;;
Esther;;AvSigVersion; Defender state information e.g. 1.217.1014.0;object;OHE;variable con 6.455 valores unicos, sin nulos. Agruparemos los valores con <1.000 registros. Variabilidad en el TARGET.;500.000;;;;2,00E-06;0.0014142135623730952;0;0;0;0;1
Esther;;IsBeta; Defender state information e.g. false;num/boolean;;variable con 2 valores (0,1) pero solo hay un valor de = 1. La borramos.;498.168;;;;68.462.065.006.182.600;10.230.489.551.371.300;0;7;7;7;35
Esther;;RtpStateBitfield; NA;num/categorica;OHE;variable con 8 valores numéricos per debería tratarse como categórica. El 96,97% en un unico valor y tiene nulos (0.37%) que yo imputaria con la moda. ;500.000;;;;0.017242;0.13017199132491844;0;0;0;0;1
Esther;;IsSxsPassiveMode; NA;num/boolean;OHE;variable con 2 valores (el 98,28% en un unico valor y sin nulos.  Variabilidad en el TARGET.;24.061;;;;16.528.245.293.213.000;10.047.542.764.651.100;1;788;1.632,00;2.381,00;3.209,00
Esther;;DefaultBrowsersIdentifier; ID for the machine's default browser;num/categorica;;variable con > 95% nulos. La borramos.;498.062;;;;4.785.090.841.300.880;1.402.308.534.631.270;3;49.480,00;53.447,00;53.447,00;70.492,00
Esther;;AVProductStatesIdentifier; ID for the specific configuration of a user's antivirus software;num/categorica;;variable con 5.517 valores distintos y 1.938 nulos. Aunque son valores numéricos debería tratarse como variable categórica. Agruparemos los valores con <1.000 registros. Variabilidad en el TARGET.;498.062;;;;13.267.625.315.723.700;0.5229998545845467;1;1;1;2;5
Esther;;AVProductsInstalled; NA;num;;variable con valores enteros del 1 al 5 (concentrados en los valores 1 y 2) y con 1.938 nulos (0,39%). Imputo con la moda. Variabilidad en el TARGET.;498.062;;;;1.020.714.288.582.540;0.16660800634034914;0;1;1;1;4
Esther;;AVProductsEnabled; NA;num;;columna con valores enteros del 1 al 4 (concentrados en los valores 1 y 2) y con 1.938 nulos (0,39%). Imputo con la moda. Variabilidad en el TARGET.;500.000;;;;0.987816;0.10970676467359902;0;1;1;1;1
Esther;;HasTpm; True if machine has tpm;num/boolean;;variable boolenana sin nulos con el 99% en el 1 y una distribucion del TARGET del 50%. La borramos.;500.000;;;;108.037.454;63.068.539.910.793.300;1;51;97;162;222
Esther;;CountryIdentifier; ID for the country the machine is located in;num/categorica;OHE;variable con 222 valores distintos sin nulos. Agrupar con < 1.000 registros.;481.760;;;;8.127.164.602.706.740;4.898.512.967.712.910;7;36.825,00;82.373,00;123.939,50;167.958,00
Esther;;CityIdentifier; ID for the city the machine is located in;num/categorica;OHE;variable con 37.157 valores distintos pero el que más valores tiene es el nulo con mas de 18.000 registros. La eliminamos porque si intentamos agrupar, la mayoría de registros quedarán con 'Others'.;345.437;;;;24.869.935.762.526.800;561.371.233.749.456;1;18;27;27;52
Esther;;OrganizationIdentifier; ID for the organization the machine belongs in, organization ID is mapped to both specific companies and broad industries;num/categorica;OHE;variable con 44 valores unicos y 154.563 valores nulos (30%) Nulos imputar con -1 y agrupar con <1.000 registros.;499.984;16;;;16.973.042.337.354.700;893.251.724.672.659;1;89;181;267;296
Esther;;GeoNameIdentifier; ID for the geographic region a machine is located in;num/categorica;OHE;268 valores unicos, 16 nulos (que imputaremos con la constante -1) y variancia en el TARGET.;500.000;;;;122.610.998;6.930.316.524.734.940;1;74;88;182;283
Esther;;LocaleEnglishNameIdentifier; English name of Locale ID of the current user;num/categorica;OHE;233 valores unicos, sin nulos. y poca varianza del TARGET. Candidata a agrupar.;500.000;4;windows10;483.048;;;;;;;
Esther;;Platform; Calculates platform name (of OS related properties and processor property);object;OHE;4 valores unicos y sin nulos.;500.000;3;x64;454.423;;;;;;;
Esther;;Processor; This is the process architecture of the installed operating system;object;OHE;3 valores unicos (el 90% concentrado en uno de los valores) y sin nulos. Variabilidad en el TARGET.;500.000;21;10.0.0.0;483.830;;;;;;;
Esther;;OsVer; Version of the current operating system;object;OHE;21 valores unicos, sin nulos y el 96.77% asignado a un ï¿½nico valor. Candidato a agrupar con > 1.000 registros.;500.000;;;;15.726.933.842;2.188.646.068.922.140;7.600,00;15.063,00;16.299,00;17.134,00;18.242,00
Esther;;OsBuild; Build of the current operating system;num/categorica;OHE;48 valores unicos, sin nulos. Candidato a agrupar con > 1.000 registros. Variabilidad en el TARGET.;500.000;;;;574.718.574;2.482.033.461.160.590;16;256;768;768;784
Jorge;21;OsPlatformSubRelease; Returns the OS Platform sub;object;;Agrupar 'perrs5' en 'rs1';500.000;9;rs4;220.779;;;;;;;
Jorge;22;OsBuildLab; Build lab that generated the current OS. Example: 9600.17630.amd64fre.winblue_r7.150109;object;;Agrupar en 'Other' por debajo del 2% ;499.999;453;17134.1.amd64fre.rs4_release.180410-1804;206.436;;;;;;;
Jorge;23;SkuEdition; The goal of this feature is to use the Product Type defined in the MSDN to map to a 'SKU;object;;Agrupar el 'Other' las minoritarias;500.000;8;Home;308.567;;;;;;;
Jorge;24;IsProtected; This is a calculated field derived from the Spynet Report's AV Products field. Returns: a. TRUE if there is at least one active and up;num/boolean;;Eliminar;498.074;;;;0.9457891799210559;0.226433456021985;0;1;1;1;1
Jorge;25;AutoSampleOptIn; This is the SubmitSamplesConsent value passed in from the service, available on CAMP 9+;num/boolean;;Eliminar;500.000;;;;2.8e-05;0.005291433832010371;0;0;0;0;1
Jorge;26;PuaMode; Pua Enabled mode from the service;object;;Eliminar;126;1;on;126;;;;;;;
Jorge;27;SMode; This field is set to true when the device is known to be in 'S Mode', as in, Windows 10 S mode, where only Microsoft Store apps can be installed;num/boolean;;Eliminar;470.152;;;;0.0004381561707703041;0.02092761623978566;0;0;0;0;1
Jorge;28;IeVerIdentifier; NA;num/categorica;;Agrupar minoritarias en etiqueta 0;496.791;;;;12.666.256.635.083.900;42.634.891.785.480.600;8;111;135;137;429
Jorge;29;SmartScreen;" This is the SmartScreen enabled string value from registry. This is obtained by checking in order, HKLM\SOFTWARE\Policies\Microsoft\Windows\System\SmartScreenEnabled and HKLM\SOFTWARE\Microsoft\Windows\CurrentVersion\Explorer\SmartScreenEnabled. If the value exists but is blank, the value ""ExistsNotSet"" is sent in telemetry.";object;;Eliminar;321.404;12;RequireAdmin;241.594;;;;;;;
Jorge;30;Firewall; This attribute is true (1) for Windows 8.1 and above if windows firewall is enabled, as reported by the service.;num/boolean;;Eliminar;494.838;;;;0.9782413638402871;0.14589462267933773;0;1;1;1;1
Jorge;31;UacLuaenable;" This attribute reports whether or not the ""administrator in Admin Approval Mode"" user type is disabled or enabled in UAC. The value reported is obtained by reading the regkey HKLM\SOFTWARE\Microsoft\Windows\CurrentVersion\Policies\System\EnableLUA.";num/categorica;;Eliminar;499.377;;;;13.725.029.386.615.700;8.995.848.053.776.320;0;1;1;1;6.357.062,00
Jorge;32;Census_MDC2FormFactor; A grouping based on a combination of Device Census level hardware characteristics. The logic used to define Form Factor is rooted in business and industry standards and aligns with how people think about their device. (Examples: Smartphone, Small Tablet, All in One, Convertibleï¿½);object;;Agrupar minoritarias en 'Other';500.000;12;Notebook;320.948;;;;;;;
Jorge;33;Census_DeviceFamily; AKA DeviceClass. Indicates the type of device that an edition of the OS is intended for. Example values: Windows.Desktop, Windows.Mobile, and iOS.Phone;object;;Eliminar;500.000;3;Windows.Desktop;499.183;;;;;;;
Jorge;34;Census_OEMNameIdentifier; NA;num/categorica;;Agrupar nulos y minoritarios en atiqueta 0;494.619;;;;2.218.646.481.433.180;13.157.096.038.465.500;54;1.443,00;2.102,00;2.668,00;6.143,00
Jorge;35;Census_OEMModelIdentifier; NA;num/categorica;;Imputar Moda. Si mete ruido en modelo, eliminar.;494.236;;;;239.128.046.882.461;7.204.888.357.697.540;1;189.641,80;247.520,00;304.438,00;345.493,00
Jorge;36;Census_ProcessorCoreCount; Number of logical cores in the processor;num/categorica;;Agrupar nulos y minoritarios en atiqueta 0;497.653;;;;3.994.074.184.220.730;20.712.812.112.891.400;1;2;4;4;88
Jorge;37;Census_ProcessorManufacturerIdentifier; NA;num/categorica;;Eliminar;497.653;;;;4.529.069.452.007.720;12.896.354.644.522.800;1;5;5;5;10
Jorge;38;Census_ProcessorModelIdentifier; NA;num/categorica;;Imputar Moda;497.651;;;;2.370.986.508.617.480;8.421.366.753.160.830;3;1.998,00;2.500,00;2.877,00;4.472,00
Jorge;39;Census_ProcessorClass; A classification of processors into high/medium/low. Initially used for Pricing Level SKU. No longer maintained and updated;object;;Eliminar;2.082;3;mid;1.196;;;;;;;
Pedro;;Census_PrimaryDiskTotalCapacity; Amount of disk space on primary disk of the machine in MB;num;;;497.024;;;;5.140.433.159.123.100;3.704.468.158.973.670;10.240,00;239.372,00;476.940,00;953.869,00;47.687.668,00
Pedro;;Census_PrimaryDiskTypeName; Friendly name of Primary Disk Type ;object;;;499.291;4;HDD;325.429;;;;;;;
Pedro;;Census_SystemVolumeTotalCapacity; The size of the partition that the System volume is installed on in MB;num;;;497.024;;;;3.780.546.392.970.960;33.847.221.873.013.800;9.689,00;120.775,00;249.450,00;475.981,00;47.687.100,00
Pedro;;Census_HasOpticalDiskDrive; True indicates that the machine has an optical disk drive (CD/DVD);num/boolean;;;500.000;;;;0.077034;0.26664565446264094;0;0;0;0;1
Pedro;;Census_TotalPhysicalRAM; Retrieves the physical RAM in MB;num;;;495.444;;;;612.923.217.558.392;4.964.521.253.116.000;512;4.096,00;4.096,00;8.192,00;393.216,00
Pedro;;Census_ChassisTypeName; Retrieves a numeric representation of what type of chassis the machine has. A value of 0 means xx;object;;;499.963;34;Notebook;294.232;;;;;;;
Pedro;;Census_InternalPrimaryDiagonalDisplaySizeInInches; Retrieves the physical diagonal length in inches of the primary display;num;;;497.346;;;;16.689.836.854.021.100;5.932.014.254.040.480;4,9;13,9;15,5;17,2;142
Pedro;;Census_InternalPrimaryDisplayResolutionHorizontal; Retrieves the number of pixels in the horizontal direction of the internal display.;num;;;497.350;;;;1.548.304.316.879.460;36.856.594.542.257.800;-1;1.366,00;1.366,00;1.920,00;11.520,00
Pedro;;Census_InternalPrimaryDisplayResolutionVertical; Retrieves the number of pixels in the vertical direction of the internal display;num;;;497.350;;;;8.982.393.445.259.870;21.486.245.039.626.200;-1;768;768;1.080,00;4.320,00
Pedro;;Census_PowerPlatformRoleName; Indicates the OEM preferred power management profile. This value helps identify the basic form factor of the device;object;;;499.998;9;Mobile;346.378;;;;;;;
Pedro;;Census_InternalBatteryType; NA;object;;;144.397;28;lion;113.500;;;;;;;
Pedro;;Census_InternalBatteryNumberOfCharges; NA;num;;;484.962;;;;11.256.001.502.055.300;18.887.684.557.803.600;0;0;0;4.294.967.295,00;4.294.967.295,00
Pedro;;Census_OSVersion; Numeric OS version Example ;object;;;500.000;305;10.0.17134.228;79.975;;;;;;;
Pedro;;Census_OSArchitecture; Architecture on which the OS is based. Derived from OSVersionFull. Example ;object;;;500.000;3;amd64;454.435;;;;;;;
Pedro;;Census_OSBranch; Branch of the OS extracted from the OsVersionFull. Example ;object;;;500.000;15;rs4_release;226.001;;;;;;;
Pedro;;Census_OSBuildNumber; OS Build number extracted from the OsVersionFull. Example ;num/categorica;;;500.000;;;;15.841.372.572;1.959.440.300.998.900;9.600,00;15.063,00;16.299,00;17.134,00;18.242,00
Pedro;;Census_OSBuildRevision; OS Build revision extracted from the OsVersionFull. Example ;num/categorica;;;500.000;;;;967.224.762;2.920.627.723.941.660;0;165;285;547;19.069,00
Pedro;;Census_OSEdition; Edition of the current OS. Sourced from HKLM\Software\Microsoft\Windows NT\CurrentVersion@EditionID in registry. Example: Enterprise;object;;;500.000;22;Core;194.469;;;;;;;
Pedro;;Census_OSSkuName; OS edition friendly name (currently Windows only);object;;;500.000;21;CORE;194.464;;;;;;;
Pedro;;Census_OSInstallTypeName; Friendly description of what install was used on the machine i.e. clean;object;;;500.000;9;UUPUpgrade;146.780;;;;;;;
Toni;0;Census_OSInstallLanguageIdentifier; NA;num;;Eliminar;496.668;;;;14.605.509.112.727.200;1.020.094.600.030.170;1;8;9;20;39
Toni;1;Census_OSUILocaleIdentifier; NA;num;;Pasar a Int8;500.000;;;;60.446.306;4.500.042.340.945.890;1;31;34;90;162
Toni;2;Census_OSWUAutoUpdateOptionsName; Friendly name of the WindowsUpdate auto;object;;Agrupar en 'UNKNOWK' ya existente;500.000;6;FullAuto;222.482;;;;;;;
Toni;3;Census_IsPortableOperatingSystem; Indicates whether OS is booted up and running via Windows;num/boolean;;Eliminar;500.000;;;;0.000522;0.022841378230245193;0;0;0;0;1
Toni;4;Census_GenuineStateName; Friendly name of OSGenuineStateID. 0 = Genuine;object;;Agrupar minoritarias en etiqueta existente 'INVALID_LICENSE';500.000;4;IS_GENUINE;441.402;;;;;;;
Toni;5;Census_ActivationChannel; Retail license key or Volume license key for a machine.;object;;Agrupar subgrupos en grupo principal de cada etiqueta;500.000;6;Retail;264.932;;;;;;;
Toni;6;Census_IsFlightingInternal; NA;num/boolean;;Eliminar;84.775;;;;2,36E+11;0.004857116687582286;0;0;0;0;1
Toni;7;Census_IsFlightsDisabled; Indicates if the machine is participating in flighting.;num/boolean;;Eliminar;491.067;;;;1,43E+11;0.0037755131886490984;0;0;0;0;1
Toni;8;Census_FlightRing; The ring that the device user would like to receive flights for. This might be different from the ring of the OS which is currently installed if the user changes the ring after getting a flight from a different ring.;object;;Eliminar;500.000;8;Retail;468.299;;;;;;;
Toni;9;Census_ThresholdOptIn; NA;num/boolean;;Eliminar;181.896;;;;0.00025838940933280553;0.016072462923288077;0;0;0;0;1
Toni;10;Census_FirmwareManufacturerIdentifier; NA;num/categorica;;Imputar nulos con 0 y agrupar minoritarios en etiqueta 0;489.651;;;;40.267.594.266.120.100;22.152.712.427.360.700;11;142;500;556;1.084,00
Toni;11;Census_FirmwareVersionIdentifier; NA;num/categorica;;Imputar moda, pasar a int64 y agrupar por inicio de version;490.939;;;;33.030.988.943.636.500;21.220.161.427.827.700;10;13.156,00;33.070,00;52.436,00;72.091,00
Toni;12;Census_IsSecureBootEnabled; Indicates if Secure Boot mode is enabled.;num/boolean;;Sin cambios;500.000;;;;0.485438;0.4997884029595878;0;0;0;1;1
Toni;13;Census_IsWIMBootEnabled; NA;num/boolean;;Eliminar;182.334;;;;0.0;0.0;0;0;0;0;0
Toni;14;Census_IsVirtualDevice; Identifies a Virtual Machine (machine learning model);num/boolean;;Eliminar;499.099;;;;0.00706673425512774;0.08376639887836018;0;0;0;0;1
Toni;15;Census_IsTouchEnabled; Is this a touch device ?;num/boolean;;Sin cambios;500.000;;;;0.125434;0.3312107049071061;0;0;0;0;1
Toni;16;Census_IsPenCapable; Is the device capable of pen input ?;num/boolean;;Eliminar;500.000;;;;0.037744;0.19057665938652138;0;0;0;0;1
Toni;17;Census_IsAlwaysOnAlwaysConnectedCapable; Retreives information about whether the battery enables the device to be AlwaysOnAlwaysConnected .;num/boolean;;Eliminar;495.960;;;;0.057244535849665296;0.23230950858641045;0;0;0;0;1
Toni;18;Wdft_IsGamer; Indicates whether the device is a gamer device or not based on its hardware combination.;num/boolean;;Imputar valor mínimo (0);483.050;;;;0.2840596211572301;0.4509658233147146;0;0;0;1;1
Toni;19;Wdft_RegionIdentifier; NA;num/categorica;;Imputar Moda y agrupar por debajo del 10% para TOP6;483.050;;;;7.888.576.751.889.030;4.551.763.623.679.090;1;3;10;11;15
;;HasDetections;;TARGET;;;500.000;;;;0.499906;0.5000004911647412;0;0;0;1;1
;;;;;;;;;;;;;;;;;
;;;;;;;;;;;;;;;;;
;;categorica-boolean;;;;;;;;;;;;;;;
;;categorica;;;;habrï¿½ que crear la variable categï¿½rica con astype(object) en el DataPreparation;;;;;;;;;;;
;;;;;;;;;;;;;;;;;
;;num;;9;;;;;;;;;;;;;
;;num/boolean;;19;;;;;;;;;;;;;
;;num/categorica;;24;;;;;;;;;;;;;
;;object;;29;;;;;;;;;;;;;
