Asignado;Columns;Columns Description;TipoVariable;Tratamiento;count;unique;top;freq;mean;std;min;00-ene-00;00-ene-00;00-ene-00;max
Esther;ProductName; Defender state information e.g. win8defender;object;variable con poca variabilidad (99% en un único valor con el target distribuido en un 50%). BORRAR?;500.000;3;win8defender;494.604;;;;;;;
Esther;EngineVersion; Defender state information e.g. 1.1.12603.0;object;variable con poca variabilidad (el 84% en dos valores). El TARGET varía entre estos dos valores ya que en uno hay más '0' y en el otro más '1'. Quizá agruparía el resto de valores distintos a estos dos.;500.000;53;1.1.15200.1;216.491;;;;;;;
Esther;AppVersion; Defender state information e.g. 4.9.10586.0;object;58% en un único valor. En general el target distribuido entorno al 50% en los 5 primeros valores... y en los siguientes ya encontramos algún valor con mayor variabilidad;500.000;95;4.18.1807.18075;288.809;;;;;;;
Esther;AvSigVersion; Defender state information e.g. 1.217.1014.0;object;variable con 6.455 valores únicos, candidata ser agrupada. Observamos que en los dos valores con más distribución se observa una diferencia en el target y esta diferencia es mayor en el resto de valores.;500.000;6.455;1.273.1420.0;5.771;;;;;;;
Esther;IsBeta; Defender state information e.g. false;num/boolean;únicamente 2 valores (0,1) pero solo hay un valor de = 1, y en el 0 la distribución del target es 50%. Asi que candidata a ser borrada.;500.000;;;;2,00E-06;0.0014142135623730952;0;0;0;0;1
Esther;RtpStateBitfield; NA;num/categorica;columna con 8 valores (el 96,97% en un único valor) y nulos (0.37%) que yo imputaría con un -1. La distribución del target varia bastante dependiendo del valor.;498.168;;;;68.462.065.006.182.600;10.230.489.551.371.300;0;7;7;7;35
Esther;IsSxsPassiveMode; NA;num/boolean;columna 2 valores (el 98,28%) en un único valor y sin nulos pero la distribución del target muy ditinta según el valor.;500.000;;;;0.017242;0.13017199132491844;0;0;0;0;1
Esther;DefaultBrowsersIdentifier; ID for the machine's default browser;num/categorica;columna con > 95% nulos. Candidata a ser borrada.;24.061;;;;16.528.245.293.213.000;10.047.542.764.651.100;1;788;1.632,00;2.381,00;3.209,00
Esther;AVProductStatesIdentifier; ID for the specific configuration of a user's antivirus software;num/categorica;columna con 5.517 valores distintos y 1.938 nulos. Bastante variabilidad del target en los valores con más registros. Candidata a ser agrupada.;498.062;;;;4.785.090.841.300.880;1.402.308.534.631.270;3;49.480,00;53.447,00;53.447,00;70.492,00
Esther;AVProductsInstalled; NA;num;columna con valores enteros del 1 al 5 (concentrados en los valores 1 y 2) y con 1.938 nulos (0,39%). Les asginaria la moda ya que al menos el 50% de los registros tienen el 1. Observamos la diferencia de la distribución del TARGET según sus valores.;498.062;;;;13.267.625.315.723.700;0.5229998545845467;1;1;1;2;5
Esther;AVProductsEnabled; NA;num;columna con valores enteros del 1 al 4 (concentrados en los valores 1 y 2) y con 1.938 nulos (0,39%). Les asginaria la moda ya que al menos el 75% de los registros tienen el 1. En este caso observamos tanta variabilidad del TARGET.;498.062;;;;1.020.714.288.582.540;0.16660800634034914;0;1;1;1;4
Esther;HasTpm; True if machine has tpm;num/boolean;columna boolenana sin nulos con el 99% en el 1 y una distribución del TARGET del 50%.;500.000;;;;0.987816;0.10970676467359902;0;1;1;1;1
Esther;CountryIdentifier; ID for the country the machine is located in;num/categorica;columna con 222 valores distintos sin nulos. Candidata a ser agrupada: quedarnos con el top que tengan más de 1.000 registros y agrupar en Others el resto.;500.000;;;;108.037.454;63.068.539.910.793.300;1;51;97;162;222
Esther;CityIdentifier; ID for the city the machine is located in;num/categorica;columna con 37.157 valores distintos con mas de 18.000 nulos. Nulos imputar con -1 y agrupar quedándons con el top que tengan más de 1.000 registros y agrupar en Others el resto.;481.760;;;;8.127.164.602.706.740;4.898.512.967.712.910;7;36.825,00;82.373,00;123.939,50;167.958,00
Esther;OrganizationIdentifier; ID for the organization the machine belongs in, organization ID is mapped to both specific companies and broad industries;num/categorica;columna con 154.563 valores nulos (30%) Nulos imputar con -1 y agrupar quedándons con el top que tengan más de 1.000 registros y agrupar en Others el resto.;345.437;;;;24.869.935.762.526.800;561.371.233.749.456;1;18;27;27;52
Esther;GeoNameIdentifier; ID for the geographic region a machine is located in;num/categorica;268 valores únicos, 16 nulos (que imputaría con la moda) y variancia en el TARGET.;499.984;;;;16.973.042.337.354.700;893.251.724.672.659;1;89;181;267;296
Esther;LocaleEnglishNameIdentifier; English name of Locale ID of the current user;num/categorica;233 valores únicos, sin nulos. y poca varianza del TARGET. Candidata a agrupar.;500.000;;;;122.610.998;6.930.316.524.734.940;1;74;88;182;283
Esther;Platform; Calculates platform name (of OS related properties and processor property);object;4 valores únicos y sin nulos.;500.000;4;windows10;483.048;;;;;;;
Esther;Processor; This is the process architecture of the installed operating system;object;3 valores únicos y sin nulos. Variabilidad en el TARGET.;500.000;3;x64;454.423;;;;;;;
Esther;OsVer; Version of the current operating system;object;21 valores únicos, sin nulos y el 96.77% asignado a un único valor. Candidato a agrupar con > 1.000 registros.;500.000;21;10.0.0.0;483.830;;;;;;;
Esther;OsBuild; Build of the current operating system;num/categorica;48 valores únicos, sin nulos. Candidato a agrupar con > 1.000 registros. Variabilidad en el TARGET.;500.000;;;;15.726.933.842;2.188.646.068.922.140;7.600,00;15.063,00;16.299,00;17.134,00;18.242,00
Jorge;OsSuite; Product suite mask for the current operating system.;num/categorica;;500.000;;;;574.718.574;2.482.033.461.160.590;16;256;768;768;784
Jorge;OsPlatformSubRelease; Returns the OS Platform sub;object;;500.000;9;rs4;220.779;;;;;;;
Jorge;OsBuildLab; Build lab that generated the current OS. Example: 9600.17630.amd64fre.winblue_r7.150109;object;;499.999;453;17134.1.amd64fre.rs4_release.180410-1804;206.436;;;;;;;
Jorge;SkuEdition; The goal of this feature is to use the Product Type defined in the MSDN to map to a 'SKU;object;;500.000;8;Home;308.567;;;;;;;
Jorge;IsProtected; This is a calculated field derived from the Spynet Report's AV Products field. Returns: a. TRUE if there is at least one active and up;num/boolean;;498.074;;;;0.9457891799210559;0.226433456021985;0;1;1;1;1
Jorge;AutoSampleOptIn; This is the SubmitSamplesConsent value passed in from the service, available on CAMP 9+;num/boolean;;500.000;;;;2.8e-05;0.005291433832010371;0;0;0;0;1
Jorge;PuaMode; Pua Enabled mode from the service;object;borrar;126;1;on;126;;;;;;;
Jorge;SMode; This field is set to true when the device is known to be in 'S Mode', as in, Windows 10 S mode, where only Microsoft Store apps can be installed;num/boolean;;470.152;;;;0.0004381561707703041;0.02092761623978566;0;0;0;0;1
Jorge;IeVerIdentifier; NA;num/categorica;;496.791;;;;12.666.256.635.083.900;42.634.891.785.480.600;8;111;135;137;429
Jorge;SmartScreen;" This is the SmartScreen enabled string value from registry. This is obtained by checking in order, HKLM\SOFTWARE\Policies\Microsoft\Windows\System\SmartScreenEnabled and HKLM\SOFTWARE\Microsoft\Windows\CurrentVersion\Explorer\SmartScreenEnabled. If the value exists but is blank, the value ""ExistsNotSet"" is sent in telemetry.";object;;321.404;12;RequireAdmin;241.594;;;;;;;
Jorge;Firewall; This attribute is true (1) for Windows 8.1 and above if windows firewall is enabled, as reported by the service.;num/boolean;;494.838;;;;0.9782413638402871;0.14589462267933773;0;1;1;1;1
Jorge;UacLuaenable;" This attribute reports whether or not the ""administrator in Admin Approval Mode"" user type is disabled or enabled in UAC. The value reported is obtained by reading the regkey HKLM\SOFTWARE\Microsoft\Windows\CurrentVersion\Policies\System\EnableLUA.";num/categorica;;499.377;;;;13.725.029.386.615.700;8.995.848.053.776.320;0;1;1;1;6.357.062,00
Jorge;Census_MDC2FormFactor; A grouping based on a combination of Device Census level hardware characteristics. The logic used to define Form Factor is rooted in business and industry standards and aligns with how people think about their device. (Examples: Smartphone, Small Tablet, All in One, Convertible…);object;;500.000;12;Notebook;320.948;;;;;;;
Jorge;Census_DeviceFamily; AKA DeviceClass. Indicates the type of device that an edition of the OS is intended for. Example values: Windows.Desktop, Windows.Mobile, and iOS.Phone;object;;500.000;3;Windows.Desktop;499.183;;;;;;;
Jorge;Census_OEMNameIdentifier; NA;num/categorica;;494.619;;;;2.218.646.481.433.180;13.157.096.038.465.500;54;1.443,00;2.102,00;2.668,00;6.143,00
Jorge;Census_OEMModelIdentifier; NA;num/categorica;;494.236;;;;239.128.046.882.461;7.204.888.357.697.540;1;189.641,80;247.520,00;304.438,00;345.493,00
Jorge;Census_ProcessorCoreCount; Number of logical cores in the processor;num/categorica;;497.653;;;;3.994.074.184.220.730;20.712.812.112.891.400;1;2;4;4;88
Jorge;Census_ProcessorManufacturerIdentifier; NA;num/categorica;;497.653;;;;4.529.069.452.007.720;12.896.354.644.522.800;1;5;5;5;10
Jorge;Census_ProcessorModelIdentifier; NA;num/categorica;;497.651;;;;2.370.986.508.617.480;8.421.366.753.160.830;3;1.998,00;2.500,00;2.877,00;4.472,00
Jorge;Census_ProcessorClass; A classification of processors into high/medium/low. Initially used for Pricing Level SKU. No longer maintained and updated;object;;2.082;3;mid;1.196;;;;;;;
Pedro;Census_PrimaryDiskTotalCapacity; Amount of disk space on primary disk of the machine in MB;num;;497.024;;;;5.140.433.159.123.100;3.704.468.158.973.670;10.240,00;239.372,00;476.940,00;953.869,00;47.687.668,00
Pedro;Census_PrimaryDiskTypeName; Friendly name of Primary Disk Type ;object;;499.291;4;HDD;325.429;;;;;;;
Pedro;Census_SystemVolumeTotalCapacity; The size of the partition that the System volume is installed on in MB;num;;497.024;;;;3.780.546.392.970.960;33.847.221.873.013.800;9.689,00;120.775,00;249.450,00;475.981,00;47.687.100,00
Pedro;Census_HasOpticalDiskDrive; True indicates that the machine has an optical disk drive (CD/DVD);num/boolean;;500.000;;;;0.077034;0.26664565446264094;0;0;0;0;1
Pedro;Census_TotalPhysicalRAM; Retrieves the physical RAM in MB;num;;495.444;;;;612.923.217.558.392;4.964.521.253.116.000;512;4.096,00;4.096,00;8.192,00;393.216,00
Pedro;Census_ChassisTypeName; Retrieves a numeric representation of what type of chassis the machine has. A value of 0 means xx;object;;499.963;34;Notebook;294.232;;;;;;;
Pedro;Census_InternalPrimaryDiagonalDisplaySizeInInches; Retrieves the physical diagonal length in inches of the primary display;num;;497.346;;;;16.689.836.854.021.100;5.932.014.254.040.480;4,9;13,9;15,5;17,2;142
Pedro;Census_InternalPrimaryDisplayResolutionHorizontal; Retrieves the number of pixels in the horizontal direction of the internal display.;num;;497.350;;;;1.548.304.316.879.460;36.856.594.542.257.800;-1;1.366,00;1.366,00;1.920,00;11.520,00
Pedro;Census_InternalPrimaryDisplayResolutionVertical; Retrieves the number of pixels in the vertical direction of the internal display;num;;497.350;;;;8.982.393.445.259.870;21.486.245.039.626.200;-1;768;768;1.080,00;4.320,00
Pedro;Census_PowerPlatformRoleName; Indicates the OEM preferred power management profile. This value helps identify the basic form factor of the device;object;;499.998;9;Mobile;346.378;;;;;;;
Pedro;Census_InternalBatteryType; NA;object;;144.397;28;lion;113.500;;;;;;;
Pedro;Census_InternalBatteryNumberOfCharges; NA;num;;484.962;;;;11.256.001.502.055.300;18.887.684.557.803.600;0;0;0;4.294.967.295,00;4.294.967.295,00
Pedro;Census_OSVersion; Numeric OS version Example ;object;;500.000;305;10.0.17134.228;79.975;;;;;;;
Pedro;Census_OSArchitecture; Architecture on which the OS is based. Derived from OSVersionFull. Example ;object;;500.000;3;amd64;454.435;;;;;;;
Pedro;Census_OSBranch; Branch of the OS extracted from the OsVersionFull. Example ;object;;500.000;15;rs4_release;226.001;;;;;;;
Pedro;Census_OSBuildNumber; OS Build number extracted from the OsVersionFull. Example ;num/categorica;;500.000;;;;15.841.372.572;1.959.440.300.998.900;9.600,00;15.063,00;16.299,00;17.134,00;18.242,00
Pedro;Census_OSBuildRevision; OS Build revision extracted from the OsVersionFull. Example ;num/categorica;;500.000;;;;967.224.762;2.920.627.723.941.660;0;165;285;547;19.069,00
Pedro;Census_OSEdition; Edition of the current OS. Sourced from HKLM\Software\Microsoft\Windows NT\CurrentVersion@EditionID in registry. Example: Enterprise;object;;500.000;22;Core;194.469;;;;;;;
Pedro;Census_OSSkuName; OS edition friendly name (currently Windows only);object;;500.000;21;CORE;194.464;;;;;;;
Pedro;Census_OSInstallTypeName; Friendly description of what install was used on the machine i.e. clean;object;;500.000;9;UUPUpgrade;146.780;;;;;;;
Toni;Census_OSInstallLanguageIdentifier; NA;num;Idioma del SO representado con valores del 1 al 39. Pasar a Int8 tras limpiar nulos.;496.668;;;;14.605.509.112.727.200;1.020.094.600.030.170;1;8;9;20;39
Toni;Census_OSUILocaleIdentifier; NA;num;Identificación lugar geografico representado con valores del 1 al 162. NO NULOS. Pasar a INT8;500.000;;;;60.446.306;4.500.042.340.945.890;1;31;34;90;162
Toni;Census_OSWUAutoUpdateOptionsName; Friendly name of the WindowsUpdate auto;object;;500.000;6;FullAuto;222.482;;;;;;;
Toni;Census_IsPortableOperatingSystem; Indicates whether OS is booted up and running via Windows;num/boolean;;500.000;;;;0.000522;0.022841378230245193;0;0;0;0;1
Toni;Census_GenuineStateName; Friendly name of OSGenuineStateID. 0 = Genuine;object;;500.000;4;IS_GENUINE;441.402;;;;;;;
Toni;Census_ActivationChannel; Retail license key or Volume license key for a machine.;object;;500.000;6;Retail;264.932;;;;;;;
Toni;Census_IsFlightingInternal; NA;num/boolean;;84.775;;;;2,36E+11;0.004857116687582286;0;0;0;0;1
Toni;Census_IsFlightsDisabled; Indicates if the machine is participating in flighting.;num/boolean;;491.067;;;;1,43E+11;0.0037755131886490984;0;0;0;0;1
Toni;Census_FlightRing; The ring that the device user would like to receive flights for. This might be different from the ring of the OS which is currently installed if the user changes the ring after getting a flight from a different ring.;object;;500.000;8;Retail;468.299;;;;;;;
Toni;Census_ThresholdOptIn; NA;num/boolean;;181.896;;;;0.00025838940933280553;0.016072462923288077;0;0;0;0;1
Toni;Census_FirmwareManufacturerIdentifier; NA;num/categorica;;489.651;;;;40.267.594.266.120.100;22.152.712.427.360.700;11;142;500;556;1.084,00
Toni;Census_FirmwareVersionIdentifier; NA;num/categorica;;490.939;;;;33.030.988.943.636.500;21.220.161.427.827.700;10;13.156,00;33.070,00;52.436,00;72.091,00
Toni;Census_IsSecureBootEnabled; Indicates if Secure Boot mode is enabled.;num/boolean;;500.000;;;;0.485438;0.4997884029595878;0;0;0;1;1
Toni;Census_IsWIMBootEnabled; NA;num/boolean;;182.334;;;;0.0;0.0;0;0;0;0;0
Toni;Census_IsVirtualDevice; Identifies a Virtual Machine (machine learning model);num/boolean;;499.099;;;;0.00706673425512774;0.08376639887836018;0;0;0;0;1
Toni;Census_IsTouchEnabled; Is this a touch device ?;num/boolean;;500.000;;;;0.125434;0.3312107049071061;0;0;0;0;1
Toni;Census_IsPenCapable; Is the device capable of pen input ?;num/boolean;;500.000;;;;0.037744;0.19057665938652138;0;0;0;0;1
Toni;Census_IsAlwaysOnAlwaysConnectedCapable; Retreives information about whether the battery enables the device to be AlwaysOnAlwaysConnected .;num/boolean;;495.960;;;;0.057244535849665296;0.23230950858641045;0;0;0;0;1
Toni;Wdft_IsGamer; Indicates whether the device is a gamer device or not based on its hardware combination.;num/boolean;;483.050;;;;0.2840596211572301;0.4509658233147146;0;0;0;1;1
Toni;Wdft_RegionIdentifier; NA;num/categorica;;483.050;;;;7.888.576.751.889.030;4.551.763.623.679.090;1;3;10;11;15
;HasDetections;;TARGET;;500.000;;;;0.499906;0.5000004911647412;0;0;0;1;1
;;;;;;;;;;;;;;;
;;;;;;;;;;;;;;;
;categorica-boolean;;;;;;;;;;;;;;
;categorica;;;habrá que crear la variable categórica con astype(object) en el DataPreparation;;;;;;;;;;;
;;;;;;;;;;;;;;;
;num;;9;;;;;;;;;;;;
;num/boolean;;19;;;;;;;;;;;;
;num/categorica;;24;;;;;;;;;;;;
;object;;29;;;;;;;;;;;;
